<?xml version="1.0" encoding="UTF-8"?>
<!DOCTYPE library SYSTEM "library.dtd">
<library>
    <book>
        <bookId>B001</bookId>
        <title>The Great Gatsby</title>
        <author>F. Scott Fitzgerald</author>
        <genre>Fiction</genre>
        <publishYear>1925</publishYear>
        <price>250.00</price>
        <available>true</available>
    </book>
    <book>
        <bookId>B002</bookId>
        <title>To Kill a Mockingbird</title>
        <author>Harper Lee</author>
        <genre>Fiction</genre>
        <publishYear>1960</publishYear>
        <price>180.00</price>
        <available>true</available>
    </book>
    <book>
        <bookId>B003</bookId>
        <title>1984</title>
        <author>George Orwell</author>
        <genre>Science Fiction</genre>
        <publishYear>1949</publishYear>
        <price>275.00</price>
        <available>false</available>
    </book>
    <book>
        <bookId>B004</bookId>
        <title>Pride and Prejudice</title>
        <author>Jane Austen</author>
        <genre>Romance</genre>
        <publishYear>1813</publishYear>
        <price>290.00</price>
        <available>true</available>
    </book>
    <book>
        <bookId>B005</bookId>
        <title>The Hobbit</title>
        <author>J.R.R. Tolkien</author>
        <genre>Fantasy</genre>
        <publishYear>1937</publishYear>
        <price>350.00</price>
        <available>true</available>
    </book>
</library>
